{
  "version": "1.0",
  "task_id": "donespec-self-validation",
  "must_pass": [
    {
      "type": "command",
      "name": "ruff lint passes",
      "run": "ruff check ."
    },
    {
      "type": "command",
      "name": "ruff format passes",
      "run": "ruff format --check ."
    },
    {
      "type": "command",
      "name": "pytest passes",
      "run": "pytest -q"
    },
    {
      "type": "file_exists",
      "name": "CLI entrypoint exists",
      "path": "src/donespec/cli.py"
    },
    {
      "type": "file_exists",
      "name": "GitHub Action exists",
      "path": "action.yml"
    },
    {
      "type": "file_exists",
      "name": "JSON schema exists",
      "path": "done.schema.json"
    },
    {
      "type": "regex_in_file",
      "name": "README contains core philosophy",
      "path": "README.md",
      "pattern": "Done means deterministically verified"
    },
    {
      "type": "regex_absent",
      "name": "No LLM dependencies in packaging",
      "path": "pyproject.toml",
      "pattern": "openai|anthropic|langchain|llama-index"
    },
    {
      "type": "file_exists",
      "name": "Agent instructions exist",
      "path": "AGENTS.md"
    },
    {
      "type": "regex_in_file",
      "name": "Agent instructions require DoneSpec validation",
      "path": "AGENTS.md",
      "pattern": "donespec validate done\\.json"
    },
    {
      "type": "file_exists",
      "name": "VS Code tasks exist",
      "path": ".vscode/tasks.json"
    },
    {
      "type": "regex_in_file",
      "name": "VS Code task runs DoneSpec validation",
      "path": ".vscode/tasks.json",
      "pattern": "donespec validate done\\.json"
    },
    {
      "type": "file_exists",
      "name": "Claude Code instructions exist",
      "path": "CLAUDE.md"
    },
    {
      "type": "regex_in_file",
      "name": "Claude imports shared agent protocol",
      "path": "CLAUDE.md",
      "pattern": "@AGENTS\\.md"
    },
    {
      "type": "regex_in_file",
      "name": "Claude instructions require DoneSpec validation",
      "path": "CLAUDE.md",
      "pattern": "donespec validate done\\.json"
    },
    {
      "type": "regex_in_file",
      "name": "CI runs DoneSpec self-validation",
      "path": ".github/workflows/ci.yml",
      "pattern": "donespec validate done\\.json"
    },
    {
      "type": "file_exists",
      "name": "Git pre-push hook exists",
      "path": ".githooks/pre-push"
    },
    {
      "type": "regex_in_file",
      "name": "Git pre-push hook runs DoneSpec",
      "path": ".githooks/pre-push",
      "pattern": "donespec validate done\\.json"
    },
    {
      "type": "file_exists",
      "name": "Git hooks installer exists",
      "path": "scripts/install-git-hooks.ps1"
    },
    {
      "type": "regex_in_file",
      "name": "Git hooks installer configures hooks path",
      "path": "scripts/install-git-hooks.ps1",
      "pattern": "core\\.hooksPath"
    },
    {
      "type": "file_exists",
      "name": "Unix Git hooks installer exists",
      "path": "scripts/install-git-hooks.sh"
    },
    {
      "type": "regex_in_file",
      "name": "Unix Git hooks installer configures hooks path",
      "path": "scripts/install-git-hooks.sh",
      "pattern": "core\\.hooksPath"
    },
    {
      "type": "regex_in_file",
      "name": "Unix Git hooks installer references DoneSpec validation",
      "path": "scripts/install-git-hooks.sh",
      "pattern": "donespec validate done\\.json"
    },
    {
      "type": "file_exists",
      "name": "Agent integration documentation exists",
      "path": "docs/agent-integration.md"
    },
    {
      "type": "regex_in_file",
      "name": "Agent integration docs mention Codex",
      "path": "docs/agent-integration.md",
      "pattern": "Codex"
    },
    {
      "type": "regex_in_file",
      "name": "Agent integration docs mention Claude Code",
      "path": "docs/agent-integration.md",
      "pattern": "Claude Code"
    },
    {
      "type": "regex_in_file",
      "name": "Agent integration docs require DoneSpec validation",
      "path": "docs/agent-integration.md",
      "pattern": "donespec validate done\\.json"
    }
  ],
  "must_not": [
    {
      "type": "file_not_modified",
      "name": "README untouched during validation",
      "path": "README.md"
    }
  ]
}
