{
  "$schema": "../../../done.schema.json",
  "version": "1.0",
  "task_id": "node-validation",
  "must_pass": [
    {
      "type": "file_exists",
      "name": "DoneSpec file exists",
      "path": "done.json"
    },
    {
      "type": "file_exists",
      "name": "package.json exists",
      "path": "package.json"
    },
    {
      "type": "command",
      "name": "npm tests pass",
      "run": "npm test"
    },
    {
      "type": "command",
      "name": "npm build passes",
      "run": "npm run build"
    }
  ],
  "must_not": []
}
